{
  "provider": "password",
  "loginUrl": "https://api.example.com/v1/login",
  "registerUrl": "https://api.example.com/v1/register",
  "logoutUrl": "https://api.example.com/v1/logout",
  "sessionUrl": "https://api.example.com/v1/session",
  "providers": [
    {
      "method": "github"
    },
    {
      "method": "google"
    }
  ],
  "methods": [
    "password",
    "github",
    "google"
  ]
}
